{
  "protocol_version": "1.0",
  "detected_at": "2026-10-08T00:00:00Z",
  "platform": {"os": "unknown", "architecture": "fixture"},
  "capabilities": [
    {"id": "web.analysis", "status": "available", "execution": "browser", "summary": "Web analysis"},
    {"id": "structure.cplfold_native", "status": "unavailable", "execution": "native", "summary": "Native runtime unavailable", "details": {"max_sequence_length": 1000}}
  ]
}
